Title	DOI	Publication.Date	PubYear	Source.title	Publisher	ISSN	e.ISSN	Publication.Type	Country.of.Research.organization	FOR..ANZSRC..Categories	for_division	for_group	discipline	Open.Access	Open.Access2	Funder	ukri_funders	Units.of.Assessment	has_ta	sherpa_id	listed_in_doaj	open_access_prohibited	g_article_version	g_license	g_license1	g_license2	g_license3	g_embargo.units	g_embargo	g_embargo2	g_embargo3	g_compliant_repository	g_copyright	rank_green	fee_article_version	fee_license1	fee_license2	fee_license3	fee_copyright	rank_fee	journal_type	articles_in_journal	num_fee	num_current_green	num_new_green	compliance_current	compliance_current2	compliance_new_hybrid	compliance_new_hybrid2	compliance_new	compliance_new2	compliance_new_pure
Spin Dependence of η Meson Production in Proton-Proton Collisions Close to Threshold	10.1103/physrevlett.120.022002	2018-01-08	2018	physical review letters	American Physical Society (APS)	0031-9007	1079-7114	Article	Germany; Sweden; Germany; Russia; India; India; Poland; Poland; Germany; Russia; Russia; India; Poland; Japan; United Kingdom; Germany; Germany; Germany; Poland; Russia; Russia; Germany	02 Physical Sciences; 0299 Other Physical Sciences	02 Physical Sciences	0299 Other Physical Sciences	Physical Sciences	Green, Published	Green	National Science Center; Science and Technology Facilities Council; Swedish Research Council; Jülich Research Centre	STFC	B09 Physics	no	13640	no	no	submitted, accepted, published	no license requirement	no license requirement	no compliant license	not cc_by	No embargo requirement	0	0	zero embargo	TRUE	authors	833	published	cc_by	cc_by	cc_by	authors	1	Hybrid	1091	2	29	7	c: hybrid gold	compliant	c: hybrid gold	compliant	nc: unconfirmed green oa	not compliant	nc: unconfirmed green oa
Multi-electric field modulation for photocatalytic oxygen evolution: Enhanced charge separation by coupling oxygen vacancies with faceted heterostructures	10.1016/j.nanoen.2018.07.018	2018-09	2018	nano energy	Elsevier	2211-2855	2211-3282	Article	United Kingdom; China; China; China; China; China	03 Chemical Sciences; 0306 Physical Chemistry (incl. Structural)	03 Chemical Sciences	0306 Physical Chemistry (incl. Structural)	Physical Sciences	Green, Submitted	Closed	Engineering and Physical Sciences Research Council; National Natural Science Foundation of China; Royal Society; Ministry of Science and Technology of the People's Republic of China	EPSRC	B12 Engineering	no	20490	no	no	accepted	cc_by_nc_nd	cc_by_nc_nd	no compliant license	not cc_by	No embargo requirement	0	0	zero embargo	FALSE	authors	710	published	cc_by	cc_by	cc_by	authors	1	Hybrid	53	2	29	7	c: hybrid gold	compliant	c: hybrid gold	compliant	not compliant	not compliant	not compliant
Elevated CO2 and high salinity enhance the abundance of sulfate reducers in a salt marsh ecosystem	10.1016/j.apsoil.2019.103386	2020-03	2020	applied soil ecology	Elsevier	0929-1393	1873-0272	Article	United Kingdom; South Korea; United Kingdom; South Korea	06 Biological Sciences; 0602 Ecology	06 Biological Sciences	0602 Ecology	Life Sciences	Green, Accepted	Green	Natural Environment Research Council; Royal Society; National Research Foundation of Korea	NERC	B07 Earth Systems and Environmental Sciences	no	12445	no	no	accepted	cc_by_nc_nd	cc_by_nc_nd	no compliant license	not cc_by	No embargo requirement	0	0	zero embargo	FALSE	authors	710	published	cc_by	cc_by	cc_by	authors	1	Hybrid	19	2	29	7	c: hybrid gold	compliant	c: hybrid gold	compliant	not compliant	not compliant	not compliant
Fungal control of early-stage bacterial community development in decomposing wood	10.1016/j.funeco.2019.100868	2019-12	2019	fungal ecology	Elsevier	1754-5048	1878-0083	Article	United Kingdom	06 Biological Sciences; 0605 Microbiology	06 Biological Sciences	0605 Microbiology	Life Sciences	Hybrid	Hybrid gold	Natural Environment Research Council	NERC	B07 Earth Systems and Environmental Sciences	no	15563	no	no	accepted	cc_by_nc_nd	cc_by_nc_nd	no compliant license	not cc_by	No embargo requirement	0	0	zero embargo	FALSE	authors	710	published	cc_by	cc_by	cc_by	authors	1	Hybrid	14	2	29	7	c: hybrid gold	compliant	c: hybrid gold	compliant	not compliant	not compliant	not compliant
Functional Capsules via Subcomponent Self-Assembly.	10.1021/acs.accounts.8b00303	2018-09-12	2018	accounts of chemical research	American Chemical Society (ACS)	0001-4842	1520-4898	Article	United Kingdom	03 Chemical Sciences; 0303 Macromolecular and Materials Chemistry; 0302 Inorganic Chemistry; 0306 Physical Chemistry (incl. Structural); 0305 Organic Chemistry	03 Chemical Sciences	0303 Macromolecular and Materials Chemistry; 0302 Inorganic Chemistry; 0306 Physical Chemistry (incl. Structural); 0305 Organic Chemistry	Physical Sciences	Green, Submitted	Closed	European Research Council; Engineering and Physical Sciences Research Council	EPSRC	B08 Chemistry	no	7760	no	no	accepted	no license requirement	no license requirement	no compliant license	not cc_by	months	12	12	has embargo	TRUE	authors	1138	published	cc_by	cc_by	cc_by	publishers	2	Hybrid	39	2	31	8	c: hybrid gold	compliant	c: hybrid gold	compliant	not compliant	not compliant	not compliant
Real-time detection of hepatitis B surface antigen using a hybrid graphene-gold nanoparticle biosensor	10.1088/2053-1583/ab734c	2020-03-05	2020	2d materials	IOP Publishing	NA	2053-1583	Article	United Kingdom; China; United Kingdom	10 Technology; 1007 Nanotechnology	10 Technology	1007 Nanotechnology	Physical Sciences	Hybrid	Hybrid gold	Ministry of Science and Technology of the People's Republic of China; European Commission; Innovate UK; Engineering and Physical Sciences Research Council	EPSRC, Innovate UK	B12 Engineering	yes	26192	no	no	accepted	no license requirement	no license requirement	no compliant license	not cc_by	No embargo requirement	0	0	zero embargo	FALSE	authors	838	published	cc_by	cc_by	cc_by	authors	1	Hybrid	72	2	29	7	c: hybrid gold	compliant	c: hybrid gold	compliant	c: hybrid gold with a TA	compliant	not compliant
Analysis of stacking disorder in ice I using pair distribution functions	10.1107/s1600576718009056	2018-07-26	2018	journal of applied crystallography	International Union of Crystallography (IUCr)	0021-8898	1600-5767	Article	United Kingdom; United Kingdom; United States; United Kingdom	02 Physical Sciences; 09 Engineering; 01 Mathematical Sciences;	02 Physical Sciences; 09 Engineering; 01 Mathematical Sciences	No FOR group recorded	Physical Sciences	Green, Published	Green	Natural Environment Research Council; European Research Council; Royal Society	NERC	B08 Chemistry	no	41	no	no	submitted, accepted	no license requirement	no license requirement	no compliant license	not cc_by	No embargo requirement	0	0	zero embargo	TRUE	authors	834	published	cc_by	cc_by	cc_by	authors	1	Hybrid	30	2	29	7	c: hybrid gold	compliant	c: hybrid gold	compliant	nc: unconfirmed green oa	not compliant	nc: unconfirmed green oa
Processes and barriers to implementation of point-of-care genotype-guided dosing of warfarin into UK outpatient anticoagulation clinics	10.2217/pgs-2019-0021	2019-05-03	2019	pharmacogenomics	Future Science Group	1462-2416	1744-8042	Article	United Kingdom; United Kingdom	11 Medical and Health Sciences;	11 Medical and Health Sciences	No FOR group recorded	Health Sciences	Hybrid	Hybrid gold	Department of Health and Social Care; National Institute for Health Research; Medical Research Council	MRC	NA	yes	12307	no	no	published	no license requirement	no license requirement	no compliant license	not cc_by	No embargo requirement	0	0	zero embargo	TRUE	authors	833	published	cc_by	cc_by	cc_by	authors	1	Hybrid	13	2	29	7	c: hybrid gold	compliant	c: hybrid gold	compliant	c: hybrid gold with a TA	compliant	nc: unconfirmed green oa
Myocyte Specific Upregulation of ACE2 in Cardiovascular Disease: Implications for SARS-CoV-2 Mediated Myocarditis	10.1161/circulationaha.120.047911	2020-06-22	2020	circulation	Wolters Kluwer	0009-7322	1524-4539	Article	United States; United States	11 Medical and Health Sciences; 1102 Cardiorespiratory Medicine and Haematology; 1103 Clinical Sciences; 1117 Public Health and Health Services	11 Medical and Health Sciences	1102 Cardiorespiratory Medicine and Haematology; 1103 Clinical Sciences; 1117 Public Health and Health Services	Health Sciences	Bronze	Closed	National Heart Lung and Blood Institute; Medical Research Council	MRC	NA	no	8733	no	no	accepted	no license requirement	no license requirement	no compliant license	not cc_by	months	6	6	has embargo	TRUE	authors	1130	published	cc_by	cc_by	cc_by	authors	1	Hybrid	95	2	30	8	c: hybrid gold	compliant	c: hybrid gold	compliant	not compliant	not compliant	not compliant
Yoga and Cardiovascular Health Trial (YACHT): a UK-based randomised mechanistic study of a yoga intervention plus usual care versus usual care alone following an acute coronary event	10.1136/bmjopen-2019-030119	2019-11-03	2019	bmj open	BMJ	NA	2044-6055	Article	United Kingdom; United Kingdom; United Kingdom; United Kingdom; United Kingdom; United Kingdom	11 Medical and Health Sciences; 1117 Public Health and Health Services	11 Medical and Health Sciences	1117 Public Health and Health Services	Health Sciences	Pure Gold	Pure Gold	National Institute for Health Research; Medical Research Council	MRC	A02 Public Health, Health Services and Primary Care	yes	17945	yes	no	submitted, accepted, published	cc_by	cc_by	cc_by	cc_by	No embargo requirement	0	0	zero embargo	TRUE	authors	1	NA	NA	NA	NA	NA	NA	Pure Gold	888	4	5	1	c: pure gold	compliant	c: pure gold	compliant	c: pure gold	compliant	c: pure gold
Observation of surf zone wave transformation using LiDAR	10.1016/j.apor.2018.05.015	2018-09	2018	applied ocean research	Elsevier	0141-1187	1879-1549	Article	Australia; United Kingdom; Australia	09 Engineering; 0909 Geomatic Engineering	09 Engineering	0909 Geomatic Engineering	Physical Sciences	Closed	Closed	Department of Education, Skills and Employment; Queensland Government; Engineering and Physical Sciences Research Council	EPSRC	B12 Engineering	no	12442	no	no	accepted	cc_by_nc_nd	cc_by_nc_nd	no compliant license	not cc_by	No embargo requirement	0	0	zero embargo	FALSE	authors	710	published	cc_by	cc_by	cc_by	authors	1	Hybrid	21	2	29	7	c: hybrid gold	compliant	c: hybrid gold	compliant	not compliant	not compliant	not compliant
Genomic imprinting, growth and maternal–fetal interactions	10.1242/jeb.164517	2018-03-07	2018	journal of experimental biology	The Company of Biologists	0022-0949	1477-9145	Article	United Kingdom	11 Medical and Health Sciences; 06 Biological Sciences; 1114 Paediatrics and Reproductive Medicine; 0604 Genetics	11 Medical and Health Sciences; 06 Biological Sciences	1114 Paediatrics and Reproductive Medicine; 0604 Genetics	Health Sciences; Life Sciences	Bronze	Closed	Medical Research Council	MRC	A01 Clinical Medicine	yes	14671	no	no	submitted, accepted, published	no license requirement	no license requirement	no compliant license	not cc_by	No embargo requirement	0	0	zero embargo	FALSE	authors	837	published	cc_by	cc_by	cc_by	authors	1	Hybrid	88	2	29	7	c: hybrid gold	compliant	c: hybrid gold	compliant	c: hybrid gold with a TA	compliant	not compliant
Historical Tropospheric and Stratospheric Ozone Radiative Forcing Using the CMIP6 Database	10.1002/2017gl076770	2018-04-06	2018	geophysical research letters	American Geophysical Union (AGU)	0094-8276	1944-8007	Article	United States; Canada; United Kingdom	03 Chemical Sciences; 0399 Other Chemical Sciences	03 Chemical Sciences	0399 Other Chemical Sciences	Physical Sciences	Bronze	Closed	Canadian Space Agency; Natural Environment Research Council; Canadian Climate Forum	NERC	B07 Earth Systems and Environmental Sciences	no	27333	no	no	submitted, accepted	no license requirement	no license requirement	no compliant license	not cc_by	No embargo requirement	0	0	zero embargo	FALSE	authors	838	published	cc_by	cc_by	cc_by	authors	1	Hybrid	528	2	29	7	c: hybrid gold	compliant	c: hybrid gold	compliant	not compliant	not compliant	not compliant
Gold nanodisc arrays as near infrared metal-enhanced fluorescence platforms with tuneable enhancement factors	10.1039/c6tc04965f	2017	2017	journal of materials chemistry c	Royal Society of Chemistry (RSC)	2050-7526	2050-7534	Article	Malaysia; United Kingdom	03 Chemical Sciences; 0306 Physical Chemistry (incl. Structural)	03 Chemical Sciences	0306 Physical Chemistry (incl. Structural)	Physical Sciences	Closed	Closed	British Council; Engineering and Physical Sciences Research Council	EPSRC	B12 Engineering	yes	25610	no	no	accepted	no license requirement	no license requirement	no compliant license	not cc_by	months	12	12	has embargo	TRUE	authors	1138	accepted, published	cc_by	cc_by	cc_by	authors	1	Hybrid	189	2	31	8	c: hybrid gold	compliant	c: hybrid gold	compliant	c: hybrid gold with a TA	compliant	not compliant
Outcomes of patients lost to follow‐up after antiretroviral therapy initiation in rural north‐eastern South Africa	10.1111/tmi.13236	2019-04-09	2019	tropical medicine and international health	Wiley	1365-3156	NA	Article	United Kingdom; South Africa	11 Medical and Health Sciences; 1117 Public Health and Health Services	11 Medical and Health Sciences	1117 Public Health and Health Services	Health Sciences	Hybrid	Hybrid gold	Bill & Melinda Gates Foundation; Medical Research Council	MRC	A02 Public Health, Health Services and Primary Care	yes	7180	no	no	accepted	no license requirement	no license requirement	no compliant license	not cc_by	months	12	12	has embargo	TRUE	authors	1138	published	cc_by	cc_by	cc_by	authors	1	Hybrid	31	2	31	8	c: hybrid gold	compliant	c: hybrid gold	compliant	c: hybrid gold with a TA	compliant	not compliant
Field testing a novel high residence positioning system for monitoring the fine‐scale movements of aquatic organisms	10.1111/2041-210x.12993	2018-03-24	2018	methods in ecology and evolution	Wiley	NA	2041-210X	Article	Bahamas; Canada; United Kingdom; Canada	06 Biological Sciences; 05 Environmental Sciences; 0502 Environmental Science and Management; 0602 Ecology; 0603 Evolutionary Biology	06 Biological Sciences; 05 Environmental Sciences	0502 Environmental Science and Management; 0602 Ecology; 0603 Evolutionary Biology	Physical Sciences; Life Sciences	Hybrid	Hybrid gold	Natural Environment Research Council; Natural Sciences and Engineering Research Council; European Research Council	NERC	A05 Biological Sciences	yes	16031	no	no	accepted	no license requirement	no license requirement	no compliant license	not cc_by	months	12	12	has embargo	TRUE	authors	1138	published	cc_by	cc_by	cc_by	authors	1	Hybrid	83	2	31	8	c: hybrid gold	compliant	c: hybrid gold	compliant	c: hybrid gold with a TA	compliant	not compliant
Liminality revisited: Mapping the emotional adaptations of women in carceral space	10.1177/1462474520959623	2020-09-17	2020	punishment & society	SAGE Publications	1462-4745	1741-3095	Article	United Kingdom; United Kingdom	18 Law and Legal Studies; 16 Studies in Human Society; 1602 Criminology; 1801 Law	18 Law and Legal Studies; 16 Studies in Human Society	1602 Criminology; 1801 Law	Social Sciences	Hybrid	Hybrid gold	Economic and Social Research Council	ESRC	C20 Social Work and Social Policy	yes	9438	no	no	accepted	no license requirement	no license requirement	no compliant license	not cc_by	No embargo requirement	0	0	zero embargo	TRUE	authors	834	published	cc_by	cc_by	cc_by	authors	1	Hybrid	6	2	25	7	c: hybrid gold	compliant	c: hybrid gold	compliant	c: hybrid gold with a TA	compliant	nc: unconfirmed green oa
VADA: an architecture for end user informed data preparation	10.1186/s40537-019-0237-9	2019-08-21	2019	journal of big data	Springer	NA	2196-1115	Article	United Kingdom; Italy; United Kingdom; United Kingdom	08 Information and Computing Sciences; 0806 Information Systems	08 Information and Computing Sciences	0806 Information Systems	Physical Sciences	Pure Gold	Pure Gold	Engineering and Physical Sciences Research Council	EPSRC	B11 Computer Science and Informatics	yes	30870	yes	no	accepted, published	cc_by	cc_by	cc_by	cc_by	No embargo requirement	0	0	zero embargo	TRUE	authors	1	NA	NA	NA	NA	NA	NA	Pure Gold	3	4	5	1	c: pure gold	compliant	c: pure gold	compliant	c: pure gold	compliant	c: pure gold
Evidence for substrate assisted catalysis in N-acetylphosphoglucosamine mutase	10.1042/bcj20180172	2018-08-16	2018	biochemical journal	Portland Press	0264-6021	1470-8728	Article	United Kingdom	06 Biological Sciences; 0601 Biochemistry and Cell Biology	06 Biological Sciences	0601 Biochemistry and Cell Biology	Life Sciences	Hybrid	Hybrid gold	Medical Research Council	MRC	B08 Chemistry	yes	15028	no	no	accepted	no license requirement	no license requirement	no compliant license	not cc_by	months	12	12	has embargo	TRUE	authors	1138	published	cc_by	cc_by	cc_by	authors	1	Hybrid	117	2	31	8	c: hybrid gold	compliant	c: hybrid gold	compliant	c: hybrid gold with a TA	compliant	not compliant
Machine-learning dessins d’enfants: explorations via modular and Seiberg–Witten curves	10.1088/1751-8121/abbc4f	2020-09-28	2020	journal of physics a: mathematical and theoretical	IOP Publishing	1751-8113	1361-6447	Article	United Kingdom; China	01 Mathematical Sciences; 02 Physical Sciences;	01 Mathematical Sciences; 02 Physical Sciences	No FOR group recorded	Physical Sciences	Green, Submitted	Closed	Science and Technology Facilities Council	STFC	B10 Mathematical Sciences	yes	11323	no	no	accepted	no license requirement	no license requirement	no compliant license	not cc_by	No embargo requirement	0	0	zero embargo	FALSE	authors	838	published	cc_by	cc_by	cc_by	authors	1	Hybrid	144	2	29	7	c: hybrid gold	compliant	c: hybrid gold	compliant	c: hybrid gold with a TA	compliant	not compliant
Cluster capture‐recapture to account for identification uncertainty on aerial surveys of animal populations	10.1111/biom.12983	2019-03	2019	biometrics	Wiley	0006-341X	1541-0420	Article	New Zealand; United Kingdom	01 Mathematical Sciences; 0104 Statistics	01 Mathematical Sciences	0104 Statistics	Physical Sciences	Green, Accepted	Green	Engineering and Physical Sciences Research Council; Natural Environment Research Council; Royal Society of New Zealand	EPSRC, NERC	B10 Mathematical Sciences	yes	3621	no	no	accepted	no license requirement	no license requirement	no compliant license	not cc_by	No embargo requirement	0	0	zero embargo	TRUE	authors	834	published	cc_by	cc_by	cc_by	authors	1	Hybrid	29	2	29	7	c: hybrid gold	compliant	c: hybrid gold	compliant	c: hybrid gold with a TA	compliant	nc: unconfirmed green oa
Khovanov Homotopy Calculations using Flow Category Calculus	10.1080/10586458.2018.1482805	2019-04-09	2019	experimental mathematics	Taylor & Francis	1058-6458	1944-950X	Article	United Kingdom; United States	01 Mathematical Sciences; 0101 Pure Mathematics	01 Mathematical Sciences	0101 Pure Mathematics	Physical Sciences	Green, Accepted	Green	Engineering and Physical Sciences Research Council	EPSRC	B10 Mathematical Sciences	yes	4127	no	no	accepted	no license requirement	no license requirement	no compliant license	not cc_by	No embargo requirement	0	0	zero embargo	FALSE	authors	838	published	cc_by	cc_by	cc_by	authors	1	Hybrid	5	2	29	7	c: hybrid gold	compliant	c: hybrid gold	compliant	c: hybrid gold with a TA	compliant	not compliant
Ultrafast photodissociation dynamics of pyrazole, imidazole and their deuterated derivatives using ab initio multiple cloning	10.1039/c9cp00039a	2019-05-15	2019	physical chemistry chemical physics	Royal Society of Chemistry (RSC)	0956-5000	1364-5455	Article	United Kingdom; United Kingdom	03 Chemical Sciences; 0306 Physical Chemistry (incl. Structural)	03 Chemical Sciences	0306 Physical Chemistry (incl. Structural)	Physical Sciences	Green, Published	Green	Leverhulme Trust; Royal Society; Engineering and Physical Sciences Research Council	EPSRC	B08 Chemistry	yes	18044	no	no	accepted	no license requirement	no license requirement	no compliant license	not cc_by	months	12	12	has embargo	TRUE	authors	1138	accepted, published	cc_by	cc_by	cc_by	authors	1	Hybrid	513	2	31	8	c: hybrid gold	compliant	c: hybrid gold	compliant	c: hybrid gold with a TA	compliant	not compliant
Exploring fuel cell cathode materials using ab initio high throughput calculations and validation using carbon supported Pt alloy catalysts	10.1039/d0cp00301h	2020-03-14	2020	physical chemistry chemical physics	Royal Society of Chemistry (RSC)	0956-5000	1364-5455	Article	United Kingdom	03 Chemical Sciences; 09 Engineering; 0306 Physical Chemistry (incl. Structural); 0912 Materials Engineering	03 Chemical Sciences; 09 Engineering	0306 Physical Chemistry (incl. Structural); 0912 Materials Engineering	Physical Sciences	Closed	Closed	Innovate UK; Department for Business, Energy and Industrial Strategy	Innovate UK	B12 Engineering	yes	18044	no	no	accepted	no license requirement	no license requirement	no compliant license	not cc_by	months	12	12	has embargo	TRUE	authors	1138	accepted, published	cc_by	cc_by	cc_by	authors	1	Hybrid	513	2	31	8	c: hybrid gold	compliant	c: hybrid gold	compliant	c: hybrid gold with a TA	compliant	not compliant
Unloading of elastoplastic spheres from large deformations	10.1016/j.powtec.2020.06.094	2020-09	2020	powder technology	Elsevier	0032-5910	1873-328X	Article	United Kingdom	09 Engineering; 0914 Resources Engineering and Extractive Metallurgy	09 Engineering	0914 Resources Engineering and Extractive Metallurgy	Physical Sciences	Closed	Closed	Engineering and Physical Sciences Research Council	EPSRC	B12 Engineering	no	16963	no	no	accepted	cc_by_nc_nd	cc_by_nc_nd	no compliant license	not cc_by	No embargo requirement	0	0	zero embargo	FALSE	authors	710	published	cc_by	cc_by	cc_by	authors	1	Hybrid	57	2	29	7	c: hybrid gold	compliant	c: hybrid gold	compliant	not compliant	not compliant	not compliant
Towards cultural materialism in the medical humanities: the case of blood rejuvenation	10.1136/medhum-2017-011209	2017-05-11	2017	medical humanities	BMJ	1468-215X	1473-4265	Article	NA	22 Philosophy and Religious Studies; 11 Medical and Health Sciences; 1199 Other Medical and Health Sciences; 2201 Applied Ethics; 2202 History and Philosophy of Specific Fields	22 Philosophy and Religious Studies; 11 Medical and Health Sciences	1199 Other Medical and Health Sciences; 2201 Applied Ethics; 2202 History and Philosophy of Specific Fields	Health Sciences; Arts & Humanities	Hybrid	Hybrid gold	Wellcome Trust; Arts and Humanities Research Council	AHRC	D27 English Language and Literature	yes	1942	no	no	accepted	cc_by_nc	cc_by_nc	cc_by_nc	not cc_by	No embargo requirement	0	0	zero embargo	TRUE	authors	642	published	cc_by	cc_by	cc_by	authors	1	Hybrid	17	2	17	5	c: hybrid gold	compliant	c: hybrid gold	compliant	c: hybrid gold with a TA	compliant	not compliant
The Spring Queen pageant and the postapartheid archive	10.1080/17533171.2016.1272239	2017-03-06	2017	safundi	Taylor & Francis	1543-1304	1753-3171	Article	South Africa	21 History and Archaeology; 2103 Historical Studies	21 History and Archaeology	2103 Historical Studies	Arts & Humanities	Green, Submitted	Closed	Arts and Humanities Research Council	AHRC	D27 English Language and Literature	yes	NA	NA	NA	NA	NA	NA	NA	NA	NA	NA	NA	NA	NA	NA	NA	NA	NA	NA	NA	NA	NA	Closed or insufficient information	8	6	99	99	not compliant	not compliant	not compliant	not compliant	not compliant	not compliant	not compliant
GAMBIT and its application in the search for physics Beyond the Standard Model	10.1016/j.ppnp.2020.103769	2020-07	2020	progress in particle and nuclear physics	Elsevier	0146-6410	1873-2224	Article	Norway; Australia; Australia; United Kingdom	02 Physical Sciences; 0202 Atomic, Molecular, Nuclear, Particle and Plasma Physics	02 Physical Sciences	0202 Atomic, Molecular, Nuclear, Particle and Plasma Physics	Physical Sciences	Green, Accepted	Green	The Research Council of Norway; Australian Research Council; Royal Society; European Commission; Science and Technology Facilities Council	STFC	B09 Physics	no	4685	no	no	accepted	cc_by_nc_nd	cc_by_nc_nd	no compliant license	not cc_by	No embargo requirement	0	0	zero embargo	FALSE	authors	710	published	cc_by	cc_by	cc_by	authors	1	Hybrid	8	2	29	7	c: hybrid gold	compliant	c: hybrid gold	compliant	not compliant	not compliant	not compliant
Photoquantum Hall Effect and Light‐Induced Charge Transfer at the Interface of Graphene/InSe Heterostructures	10.1002/adfm.201805491	2018-11-27	2018	advanced functional materials	Wiley	1616-301X	1616-3028	Article	United Kingdom; Russia; France; Japan; United Kingdom; China	09 Engineering; 02 Physical Sciences; 0204 Condensed Matter Physics; 0912 Materials Engineering	09 Engineering; 02 Physical Sciences	0204 Condensed Matter Physics; 0912 Materials Engineering	Physical Sciences	Green, Accepted	Green	European Commission; Chinese Academy of Sciences; Russian Science Foundation; European Research Council; Leverhulme Trust; Japan Society for the Promotion of Science; Engineering and Physical Sciences Research Council; Royal Society	EPSRC	B09 Physics; B12 Engineering	yes	228	no	no	accepted	no license requirement	no license requirement	no compliant license	not cc_by	months	12	12	has embargo	TRUE	authors	1138	published	cc_by	cc_by	cc_by	authors	1	Hybrid	186	2	31	8	c: hybrid gold	compliant	c: hybrid gold	compliant	c: hybrid gold with a TA	compliant	not compliant
Methods to assess binocular rivalry with periodic stimuli	10.1186/s13408-020-00087-8	2020-06-15	2020	the journal of mathematical neuroscience	Springer	NA	2190-8567	Article	United Kingdom	01 Mathematical Sciences; 0102 Applied Mathematics	01 Mathematical Sciences	0102 Applied Mathematics	Physical Sciences	Pure Gold	Pure Gold	Engineering and Physical Sciences Research Council	EPSRC	B10 Mathematical Sciences	yes	19671	yes	no	accepted, published	cc_by	cc_by	cc_by	cc_by	No embargo requirement	0	0	zero embargo	TRUE	authors	1	NA	NA	NA	NA	NA	NA	Pure Gold	8	4	5	1	c: pure gold	compliant	c: pure gold	compliant	c: pure gold	compliant	c: pure gold
