Title	DOI	Publication.Date	PubYear	Source.title	Publisher	ISSN	e.ISSN	Publication.Type	Country.of.Research.organization	FOR..ANZSRC..Categories	for_division	for_group	discipline	Open.Access	Open.Access2	Funder	ukri_funders	Units.of.Assessment	has_ta	sherpa_id	listed_in_doaj	open_access_prohibited	g_article_version	g_license	g_license1	g_license2	g_license3	g_embargo.units	g_embargo	g_embargo2	g_embargo3	g_compliant_repository	g_copyright	rank_green	fee_article_version	fee_license1	fee_license2	fee_license3	fee_copyright	rank_fee	journal_type	articles_in_journal	num_fee	num_current_green	num_new_green	compliance_current	compliance_current2	compliance_new_hybrid	compliance_new_hybrid2	compliance_new	compliance_new2	compliance_new_pure
Genetic effects influencing risk for major depressive disorder in China and Europe	10.1038/tp.2016.292	2017-03-28	2017	translational psychiatry	Springer	NA	2158-3188	Article	United Kingdom; United States; United States; Netherlands; United Kingdom; Australia; United States; United States; United States; Australia; United States; United States; Denmark; Ireland; Germany; United States; Germany; United States; United States; Germany; United Kingdom; United States; United Kingdom; United States; United States; Germany; United Kingdom; Australia; Germany; United States; Netherlands; Germany; Denmark; Germany; Australia; Netherlands; Germany; Netherlands; United States; United States; United Kingdom; Netherlands; United States; Netherlands; Spain; United States; Switzerland; Germany; Sweden; United States	11 Medical and Health Sciences; 17 Psychology and Cognitive Sciences; 1103 Clinical Sciences; 1701 Psychology; 1117 Public Health and Health Services	11 Medical and Health Sciences; 17 Psychology and Cognitive Sciences	1103 Clinical Sciences; 1701 Psychology; 1117 Public Health and Health Services	Health Sciences; Social Sciences	Pure Gold	Pure Gold	Medical Research Council; Scottish Funding Council; National Institute of Mental Health; Wellcome Trust; Dutch Research Council; National Institute on Drug Abuse; National Institute on Alcohol Abuse and Alcoholism; Federal Ministry of Education and Research; Chief Scientist Office; United States National Library of Medicine; Dutch Brain Foundation	MRC	A04 Psychology, Psychiatry and Neuroscience	yes	24221	yes	no	submitted, accepted, published	cc_by	cc_by	cc_by	cc_by	No embargo requirement	0	0	zero embargo	TRUE	authors	1	NA	NA	NA	NA	NA	NA	Pure Gold	159	4	5	1	c: pure gold	compliant	c: pure gold	compliant	c: pure gold	compliant	c: pure gold
Coral symbiosis is a three-player game	10.1038/d41586-019-00949-6	2019-04-03	2019	nature	Nature	0028-0836	1476-4687	Article	NA	NA	Missing	No FOR group recorded	Missing	Bronze	Closed	Natural Environment Research Council; National Institute of General Medical Sciences	NERC	NA	no	4008	no	no	accepted	no license requirement	no license requirement	no compliant license	not cc_by	months	6	6	has embargo	TRUE	authors	1130	NA	NA	NA	NA	NA	NA	Closed or insufficient information	632	6	30	8	not compliant	not compliant	not compliant	not compliant	not compliant	not compliant	not compliant
“El nen s'ha menjat una aranya”: The development of narratives in Catalan speaking children	10.1017/s0305000920000057	2020-05-01	2020	journal of child language	Cambridge University Press (CUP)	0305-0009	1469-7602	Article	Spain; United Kingdom; Spain; Spain; United Kingdom	20 Language, Communication and Culture; 2004 Linguistics	20 Language, Communication and Culture	2004 Linguistics	Arts & Humanities	Green, Accepted	Green	Economic and Social Research Council	ESRC	D26 Modern Languages and Linguistics	yes	1614	no	no	accepted	cc_by_nc_nd	cc_by_nc_nd	no compliant license	not cc_by	No embargo requirement	0	0	zero embargo	TRUE	authors	706	published	cc_by	cc_by	cc_by	authors	1	Hybrid	10	2	25	7	c: hybrid gold	compliant	c: hybrid gold	compliant	c: hybrid gold with a TA	compliant	not compliant
Alcohol Dehydrogenase‐Triggered Oxa‐Michael Reaction for the Asymmetric Synthesis of Disubstituted Tetrahydropyrans and Tetrahydrofurans	10.1002/cctc.201900658	2019-07-09	2019	chemcatchem	Wiley	1867-3880	1867-3899	Article	United Kingdom; Ireland; United Kingdom	03 Chemical Sciences; 0305 Organic Chemistry	03 Chemical Sciences	0305 Organic Chemistry	Physical Sciences	Green, Accepted	Green	Engineering and Physical Sciences Research Council	EPSRC	B08 Chemistry	yes	1460	no	no	accepted	no license requirement	no license requirement	no compliant license	not cc_by	months	12	12	has embargo	TRUE	authors	1138	published	cc_by	cc_by	cc_by	authors	1	Hybrid	58	2	31	8	c: hybrid gold	compliant	c: hybrid gold	compliant	c: hybrid gold with a TA	compliant	not compliant
Motion of a non-axisymmetric particle in viscous shear flow	10.1017/jfm.2019.367	2019-06-10	2019	journal of fluid mechanics	Cambridge University Press (CUP)	0022-1120	1469-7645	Article	United Kingdom	01 Mathematical Sciences; 0101 Pure Mathematics	01 Mathematical Sciences	0101 Pure Mathematics	Physical Sciences	Green, Submitted	Closed	Engineering and Physical Sciences Research Council	EPSRC	B10 Mathematical Sciences	yes	1706	no	no	accepted	cc_by_nc_nd	cc_by_nc_nd	no compliant license	not cc_by	No embargo requirement	0	0	zero embargo	FALSE	authors	710	published	cc_by	cc_by	cc_by	authors	1	Hybrid	395	2	29	7	c: hybrid gold	compliant	c: hybrid gold	compliant	c: hybrid gold with a TA	compliant	not compliant
Fifty years of child height and weight in Japan and South Korea: Contrasting secular trend patterns analyzed by SITAR	10.1002/ajhb.23054	2017-08-23	2017	american journal of human biology	Wiley	1042-0533	1520-6300	Article	Japan	11 Medical and Health Sciences; 1117 Public Health and Health Services	11 Medical and Health Sciences	1117 Public Health and Health Services	Health Sciences	Hybrid	Hybrid gold	Medical Research Council	MRC	A02 Public Health, Health Services and Primary Care	yes	4671	no	no	accepted	no license requirement	no license requirement	no compliant license	not cc_by	months	12	12	has embargo	TRUE	authors	1138	published	cc_by	cc_by	cc_by	authors	1	Hybrid	11	2	31	8	c: hybrid gold	compliant	c: hybrid gold	compliant	c: hybrid gold with a TA	compliant	not compliant
A Simultaneous Differential Scanning Calorimetry-X-ray Diffraction Study of Olanzapine Crystallization from Amorphous Solid Dispersions.	10.1021/acs.molpharmaceut.0c00846	2020-10-19	2020	molecular pharmaceutics	American Chemical Society (ACS)	1543-8384	1543-8392	Article	United Kingdom; China; United Kingdom	03 Chemical Sciences; 0303 Macromolecular and Materials Chemistry	03 Chemical Sciences	0303 Macromolecular and Materials Chemistry	Physical Sciences	Closed	Closed	Engineering and Physical Sciences Research Council	EPSRC	A03 Allied Health Professions, Dentistry, Nursing and Pharmacy	no	7791	no	no	accepted	no license requirement	no license requirement	no compliant license	not cc_by	months	12	12	has embargo	TRUE	authors	1138	published	cc_by	cc_by	cc_by	publishers	2	Hybrid	65	2	31	8	c: hybrid gold	compliant	c: hybrid gold	compliant	not compliant	not compliant	not compliant
Exposing Toxoplasma gondii hiding inside the vacuole: a role for GBPs, autophagy and host cell death	10.1016/j.mib.2017.10.021	2017-11-12	2017	current opinion in microbiology	Elsevier	1369-5274	1879-0364	Article	United Kingdom; United States	11 Medical and Health Sciences; 06 Biological Sciences; 0601 Biochemistry and Cell Biology; 1108 Medical Microbiology	11 Medical and Health Sciences; 06 Biological Sciences	0601 Biochemistry and Cell Biology; 1108 Medical Microbiology	Health Sciences; Life Sciences	Hybrid	Hybrid gold	The Francis Crick Institute; National Eye Institute; Cancer Research UK; Medical Research Council; National Institute of Allergy and Infectious Diseases; Wellcome Trust	MRC	A01 Clinical Medicine	no	11165	no	no	accepted	cc_by_nc_nd	cc_by_nc_nd	no compliant license	not cc_by	No embargo requirement	0	0	zero embargo	FALSE	authors	710	published	cc_by	cc_by	cc_by	authors	1	Hybrid	36	2	29	7	c: hybrid gold	compliant	c: hybrid gold	compliant	not compliant	not compliant	not compliant
SKIM, a Candidate Satellite Mission Exploring Global Ocean Currents and Waves	10.3389/fmars.2019.00209	2019-01-01	2019	frontiers in marine science	Frontiers	2296-7745	NA	Article	United Kingdom; Norway; Netherlands; Netherlands; Germany; France; Italy; United States; United Kingdom; Netherlands; Germany; Norway; France; France; Germany; Italy; United Kingdom	04 Earth Sciences; 0405 Oceanography	04 Earth Sciences	0405 Oceanography	Physical Sciences	Pure Gold	Pure Gold	National Agency for Research; Natural Environment Research Council	NERC	B07 Earth Systems and Environmental Sciences	no	26075	yes	no	published	cc_by	cc_by	cc_by	cc_by	No embargo requirement	0	0	zero embargo	TRUE	authors	1	published	cc_by	cc_by	cc_by	authors	1	Pure Gold	171	1	5	1	c: pure gold	compliant	c: pure gold	compliant	c: pure gold	compliant	c: pure gold
Nanoscale analysis of ion irradiated ODS 14YWT ferritic alloy	10.1016/j.jnucmat.2019.151852	2020-01	2020	journal of nuclear materials	Elsevier	0022-3115	1873-4820	Article	Spain; United Kingdom; United States	09 Engineering; 0912 Materials Engineering	09 Engineering	0912 Materials Engineering	Physical Sciences	Closed	Closed	Sony Corporation (United States); Comunidad de Madrid; Engineering and Physical Sciences Research Council; United States Department of Energy	EPSRC	B12 Engineering	no	11435	no	no	accepted	cc_by_nc_nd	cc_by_nc_nd	no compliant license	not cc_by	No embargo requirement	0	0	zero embargo	FALSE	authors	710	published	cc_by	cc_by	cc_by	authors	1	Hybrid	119	2	29	7	c: hybrid gold	compliant	c: hybrid gold	compliant	not compliant	not compliant	not compliant
Market microstructure, banks’ behaviour and interbank spreads: evidence after the crisis	10.1007/s11403-019-00248-3	2019-04-06	2019	journal of economic interaction and coordination	Springer	1860-711X	1860-7128	Article	United Arab Emirates; United Kingdom; United Kingdom; Italy; Italy	14 Economics; 1402 Applied Economics	14 Economics	1402 Applied Economics	Social Sciences	Green, Accepted	Green	European Commission; Economic and Social Research Council	ESRC	C17 Business and Management Studies	yes	8061	no	no	accepted	no license requirement	no license requirement	no compliant license	not cc_by	No embargo requirement	0	0	zero embargo	FALSE	authors	838	published	cc_by	cc_by	cc_by	authors	1	Hybrid	3	2	25	7	c: hybrid gold	compliant	c: hybrid gold	compliant	c: hybrid gold with a TA	compliant	not compliant
Synthesis of SMT022357 enantiomers and in vivo evaluation in a Duchenne muscular dystrophy mouse model	10.1016/j.tet.2019.130819	2020-01	2020	tetrahedron	Elsevier	0040-4020	1464-5416	Article	United Kingdom; United Kingdom	03 Chemical Sciences; 0305 Organic Chemistry	03 Chemical Sciences	0305 Organic Chemistry	Physical Sciences	Hybrid	Hybrid gold	Medical Research Council; European Commission; Home Office	MRC	A01 Clinical Medicine	no	15869	no	no	accepted	cc_by_nc_nd	cc_by_nc_nd	no compliant license	not cc_by	No embargo requirement	0	0	zero embargo	FALSE	authors	710	published	cc_by	cc_by	cc_by	authors	1	Hybrid	91	2	29	7	c: hybrid gold	compliant	c: hybrid gold	compliant	not compliant	not compliant	not compliant
How to make the propagation time through an optical fiber fully insensitive to temperature variations	10.1364/optica.4.000659	2017-06-13	2017	optica	The Optical Society	NA	2334-2536	Article	NA	02 Physical Sciences; 09 Engineering; 10 Technology; 1005 Communications Technologies; 0906 Electrical and Electronic Engineering; 0205 Optical Physics	02 Physical Sciences; 09 Engineering; 10 Technology	1005 Communications Technologies; 0906 Electrical and Electronic Engineering; 0205 Optical Physics	Physical Sciences	Pure Gold	Pure Gold	Wolfson Foundation; Engineering and Physical Sciences Research Council; Royal Society	EPSRC	NA	no	29756	yes	no	accepted, published	cc_by	cc_by	cc_by	cc_by	No embargo requirement	0	0	zero embargo	TRUE	publishers	3	NA	NA	NA	NA	NA	NA	Pure Gold	74	4	5	1	c: pure gold	compliant	c: pure gold	compliant	c: pure gold	compliant	c: pure gold
Impact of hydrodynamics on iPSC-derived cardiomyocyte differentiation processes	10.1016/j.jbiotec.2018.07.028	2018-09-10	2018	journal of biotechnology	Elsevier	0168-1656	1873-4863	Article	Portugal; Portugal; United Kingdom	09 Engineering; 0915 Interdisciplinary Engineering	09 Engineering	0915 Interdisciplinary Engineering	Physical Sciences	Green, Submitted	Closed	Engineering and Physical Sciences Research Council; European Commission; Fundação para a Ciência e Tecnologia; Foundation for Science and Technology	EPSRC	B12 Engineering	no	13783	no	no	accepted	cc_by_nc_nd	cc_by_nc_nd	no compliant license	not cc_by	No embargo requirement	0	0	zero embargo	FALSE	authors	710	published	cc_by	cc_by	cc_by	authors	1	Hybrid	12	2	29	7	c: hybrid gold	compliant	c: hybrid gold	compliant	not compliant	not compliant	not compliant
The mineralogy, petrology, and composition of anomalous eucrite Emmaville	10.1111/maps.12818	2017-02-02	2017	meteoritics and planetary science	Wiley	1086-9379	1945-5100	Article	United Kingdom; United States; United Kingdom; United States	04 Earth Sciences; 0403 Geology	04 Earth Sciences	0403 Geology	Physical Sciences	Hybrid	Hybrid gold	National Aeronautics and Space Administration; Science and Technology Facilities Council	STFC	B07 Earth Systems and Environmental Sciences	yes	6925	no	no	accepted	no license requirement	no license requirement	no compliant license	not cc_by	months	12	12	has embargo	TRUE	authors	1138	published	cc_by	cc_by	cc_by	authors	1	Hybrid	54	2	31	8	c: hybrid gold	compliant	c: hybrid gold	compliant	c: hybrid gold with a TA	compliant	not compliant
Does urinary cytology have a role in haematuria investigations?	10.1111/bju.14459	2018-08-29	2018	bju international	Wiley	1464-4096	1464-410X	Article	United Kingdom; United Kingdom; United Kingdom; United Kingdom; United Kingdom; United Kingdom; United Kingdom; United Kingdom; United Kingdom; United Kingdom	11 Medical and Health Sciences; 1112 Oncology and Carcinogenesis	11 Medical and Health Sciences	1112 Oncology and Carcinogenesis	Health Sciences	Hybrid	Hybrid gold	Medical Research Council	MRC	A01 Clinical Medicine	yes	3622	no	no	accepted	no license requirement	no license requirement	no compliant license	not cc_by	months	12	12	has embargo	TRUE	authors	1138	published	cc_by	cc_by	cc_by	authors	1	Hybrid	40	2	31	8	c: hybrid gold	compliant	c: hybrid gold	compliant	c: hybrid gold with a TA	compliant	not compliant
Cleaning of thick viscoplastic surface deposits using an impinging jet: Effect of process variables.	10.1016/j.jfoodeng.2019.109699	2020-02	2020	journal of food engineering	Elsevier	0260-8774	1873-5770	Article	United Kingdom	09 Engineering; 0915 Interdisciplinary Engineering	09 Engineering	0915 Interdisciplinary Engineering	Physical Sciences	Green, Submitted	Closed	Procter & Gamble (United States); Engineering and Physical Sciences Research Council	EPSRC	B12 Engineering	no	13933	no	no	accepted	cc_by_nc_nd	cc_by_nc_nd	no compliant license	not cc_by	No embargo requirement	0	0	zero embargo	FALSE	authors	710	published	cc_by	cc_by	cc_by	authors	1	Hybrid	22	2	29	7	c: hybrid gold	compliant	c: hybrid gold	compliant	not compliant	not compliant	not compliant
Sarah K. Gillespie , The Early American Daguerreotype: Cross-currents in Art and Technology. Cambridge, MA: MIT Press, 2016, Pp. x + 213. ISBN 978 0 2620 3410 4. £23.95 (cloth).	10.1017/s0007087417000711	2017-09-19	2017	the british journal for the history of science	Cambridge University Press (CUP)	0007-0874	1474-001X	Article	United Kingdom	22 Philosophy and Religious Studies; 21 History and Archaeology; 2202 History and Philosophy of Specific Fields; 2103 Historical Studies	22 Philosophy and Religious Studies; 21 History and Archaeology	2202 History and Philosophy of Specific Fields; 2103 Historical Studies	Arts & Humanities	Bronze	Closed	Arts and Humanities Research Council	AHRC	NA	yes	2199	no	no	accepted	cc_by_nc_nd	cc_by_nc_nd	no compliant license	not cc_by	No embargo requirement	0	0	zero embargo	TRUE	authors	706	published	cc_by	cc_by	cc_by	authors	1	Hybrid	5	2	25	7	c: hybrid gold	compliant	c: hybrid gold	compliant	c: hybrid gold with a TA	compliant	not compliant
Return period of extreme rainfall substantially decreases under 1.5 °C and 2.0 °C warming: a case study for Uttarakhand, India	10.1088/1748-9326/ab0bce	2019-04-17	2019	environmental research letters	IOP Publishing	1748-9318	1748-9326	Article	NA	04 Earth Sciences; 0401 Atmospheric Sciences	04 Earth Sciences	0401 Atmospheric Sciences	Physical Sciences	Pure Gold	Pure Gold	Engineering and Physical Sciences Research Council	EPSRC	C14 Geography and Environmental Studies	yes	11263	yes	no	submitted, accepted, published	cc_by	cc_by	cc_by	cc_by	No embargo requirement	0	0	zero embargo	TRUE	authors	1	published	cc_by	cc_by	cc_by	authors	1	Pure Gold	199	1	5	1	c: pure gold	compliant	c: pure gold	compliant	c: pure gold	compliant	c: pure gold
SN 2016B a.k.a. ASASSN-16ab: a transitional Type II supernova	10.1093/mnras/stz949	2019-04-23	2019	monthly notices of the royal astronomical society	Oxford University Press (OUP)	0035-8711	1365-2966	Article	United States; Italy; India; India; United States; India; India; Italy	02 Physical Sciences; 0299 Other Physical Sciences	02 Physical Sciences	0299 Other Physical Sciences	Physical Sciences	Bronze	Closed	Science and Engineering Research Board; Department of Science and Technology; Science and Technology Facilities Council; National Aeronautics and Space Administration	STFC	B09 Physics	yes	24618	no	no	published	no license requirement	no license requirement	no compliant license	not cc_by	No embargo requirement	0	0	zero embargo	TRUE	authors	833	published	cc_by	cc_by	cc_by	authors	1	Hybrid	2779	2	29	7	c: hybrid gold	compliant	c: hybrid gold	compliant	c: hybrid gold with a TA	compliant	nc: unconfirmed green oa
The El Niño event of 2015–2016: climate anomalies and their impact on groundwater resources in East and Southern Africa	10.5194/hess-23-1751-2019	2019-03-29	2019	hydrology and earth system sciences	Copernicus Publications	1027-5606	1607-7938	Article	United Kingdom; United Kingdom; United Kingdom; Tanzania; United Kingdom; United Kingdom	04 Earth Sciences; 0406 Physical Geography and Environmental Geoscience	04 Earth Sciences	0406 Physical Geography and Environmental Geoscience	Physical Sciences	Pure Gold	Pure Gold	Natural Environment Research Council; Leverhulme Trust; Economic and Social Research Council; Royal Society; Engineering and Physical Sciences Research Council	ESRC, EPSRC, NERC	C14 Geography and Environmental Studies	no	1254	yes	no	submitted, accepted, published	cc_by	cc_by	cc_by	cc_by	No embargo requirement	0	0	zero embargo	TRUE	authors	1	NA	NA	NA	NA	NA	NA	Pure Gold	63	4	5	1	c: pure gold	compliant	c: pure gold	compliant	c: pure gold	compliant	c: pure gold
Examining patterns in opioid prescribing for non-cancer-related pain in Wales: preliminary data from a retrospective cross-sectional study using large datasets	10.1177/2049463718800737	2018-09-25	2018	british journal of pain	SAGE Publications	2049-4637	2049-4645	Article	United Kingdom	11 Medical and Health Sciences; 1117 Public Health and Health Services	11 Medical and Health Sciences	1117 Public Health and Health Services	Health Sciences	Green, Published	Green	Pharmacy Research UK; Economic and Social Research Council	ESRC	A03 Allied Health Professions, Dentistry, Nursing and Pharmacy; A02 Public Health, Health Services and Primary Care	yes	24711	no	no	accepted	no license requirement	no license requirement	no compliant license	not cc_by	No embargo requirement	0	0	zero embargo	TRUE	authors	834	published	cc_by	cc_by	cc_by	authors	1	Hybrid	3	2	25	7	c: hybrid gold	compliant	c: hybrid gold	compliant	c: hybrid gold with a TA	compliant	nc: unconfirmed green oa
A Universe that Does Not Know the Time	10.3390/universe5030084	2019-03-01	2019	universe	MDPI	0043-9592	2218-1997	Article	United Kingdom; Canada	02 Physical Sciences; 0202 Atomic, Molecular, Nuclear, Particle and Plasma Physics	02 Physical Sciences	0202 Atomic, Molecular, Nuclear, Particle and Plasma Physics	Physical Sciences	Pure Gold	Pure Gold	Science and Technology Facilities Council	STFC	B10 Mathematical Sciences	no	35330	yes	no	published	cc_by	cc_by	cc_by	cc_by	No embargo requirement	0	0	zero embargo	TRUE	authors	1	published	cc_by	cc_by	cc_by	authors	1	Pure Gold	19	1	5	1	c: pure gold	compliant	c: pure gold	compliant	c: pure gold	compliant	c: pure gold
Phenotype, penetrance, and treatment of 133 cytotoxic T-lymphocyte antigen 4–insufficient subjects	10.1016/j.jaci.2018.02.055	2018-05-04	2018	journal of allergy and clinical immunology	Elsevier	0091-6749	1097-6825	Article	Spain; Germany; Germany; Germany; United Kingdom; United States; Germany; Canada; United Kingdom; Switzerland; United States; United States; Norway; United States; Spain; Australia; Germany; Germany; Spain; United Kingdom; Czechia; Belgium; United Kingdom; Switzerland; Czechia; Germany; Czechia; United States; Germany; Germany; Japan; Germany; United Kingdom; Greece; United States; Japan; United States; Norway; United Kingdom; Canada; United Kingdom; United States; Switzerland; Switzerland; Italy; Germany; Czechia; Germany	11 Medical and Health Sciences; 1107 Immunology	11 Medical and Health Sciences	1107 Immunology	Health Sciences	Green, Accepted	Green	Japan Society for the Promotion of Science; Swiss National Science Foundation; National Cancer Institute; Japan Agency for Medical Research and Development; Biotechnology and Biological Sciences Research Council; National Institute of Allergy and Infectious Diseases	BBSRC	A01 Clinical Medicine	no	3193	no	no	accepted	cc_by_nc_nd	cc_by_nc_nd	no compliant license	not cc_by	No embargo requirement	0	0	zero embargo	FALSE	authors	710	published	cc_by	cc_by	cc_by	authors	1	Hybrid	166	2	29	7	c: hybrid gold	compliant	c: hybrid gold	compliant	not compliant	not compliant	not compliant
Crystal structures of a GABAA-receptor chimera reveal new endogenous neurosteroid-binding sites	10.1038/nsmb.3477	2017-10-02	2017	nature structural & molecular biology	Nature	1545-9993	2331-365X	Article	United Kingdom; United Kingdom; France; France	11 Medical and Health Sciences; 06 Biological Sciences; 03 Chemical Sciences;	11 Medical and Health Sciences; 06 Biological Sciences; 03 Chemical Sciences	No FOR group recorded	Physical Sciences; Health Sciences; Life Sciences	Green, Accepted	Green	Royal Society; Wellcome Trust; Biotechnology and Biological Sciences Research Council; Engineering and Physical Sciences Research Council; Medical Research Council	BBSRC, EPSRC, MRC	NA	no	4026	no	no	accepted	no license requirement	no license requirement	no compliant license	not cc_by	months	6	6	has embargo	TRUE	authors	1130	NA	NA	NA	NA	NA	NA	Closed or insufficient information	81	6	30	8	not compliant	not compliant	not compliant	not compliant	not compliant	not compliant	not compliant
A cut finite element method for the Bernoulli free boundary value problem	10.1016/j.cma.2016.12.021	2017-04	2017	computer methods in applied mechanics and engineering	Elsevier	0045-7825	1879-2138	Article	Sweden; United Kingdom; Sweden	01 Mathematical Sciences; 0103 Numerical and Computational Mathematics	01 Mathematical Sciences	0103 Numerical and Computational Mathematics	Physical Sciences	Green, Submitted	Closed	Swedish Foundation for Strategic Research; Engineering and Physical Sciences Research Council; Swedish Research Council	EPSRC	B10 Mathematical Sciences	no	12450	no	no	accepted	cc_by_nc_nd	cc_by_nc_nd	no compliant license	not cc_by	No embargo requirement	0	0	zero embargo	FALSE	authors	710	published	cc_by	cc_by	cc_by	authors	1	Hybrid	76	2	29	7	c: hybrid gold	compliant	c: hybrid gold	compliant	not compliant	not compliant	not compliant
Enhancing easy-plane anisotropy in bespoke Ni(II) quantum magnets	10.1016/j.poly.2020.114379	2020-04	2020	polyhedron	Elsevier	0277-5387	1873-3719	Article	United Kingdom; United States; United States; Switzerland; United Kingdom; United States; United Kingdom; Switzerland; Denmark; United States; United States	03 Chemical Sciences; 0302 Inorganic Chemistry	03 Chemical Sciences	0302 Inorganic Chemistry	Physical Sciences	Hybrid	Hybrid gold	Los Alamos National Laboratory; United States Department of Energy; Science and Technology Facilities Council; Argonne National Laboratory; Directorate for Mathematical & Physical Sciences; Office of Basic Energy Sciences; Engineering and Physical Sciences Research Council; European Research Council	EPSRC, STFC	B12 Engineering	no	4678	no	no	accepted	cc_by_nc_nd	cc_by_nc_nd	no compliant license	not cc_by	No embargo requirement	0	0	zero embargo	FALSE	authors	710	published	cc_by	cc_by	cc_by	authors	1	Hybrid	37	2	29	7	c: hybrid gold	compliant	c: hybrid gold	compliant	not compliant	not compliant	not compliant
Antibody response to common human viruses is shaped by genetic factors	10.1016/j.jaci.2018.11.039	2018-12-20	2018	journal of allergy and clinical immunology	Elsevier	0091-6749	1097-6825	Article	Australia; Australia; United Kingdom; France; Australia; Australia	11 Medical and Health Sciences; 1107 Immunology	11 Medical and Health Sciences	1107 Immunology	Health Sciences	Bronze	Closed	Medical Research Council; National Health and Medical Research Council	MRC	NA	no	3193	no	no	accepted	cc_by_nc_nd	cc_by_nc_nd	no compliant license	not cc_by	No embargo requirement	0	0	zero embargo	FALSE	authors	710	published	cc_by	cc_by	cc_by	authors	1	Hybrid	166	2	29	7	c: hybrid gold	compliant	c: hybrid gold	compliant	not compliant	not compliant	not compliant
