Title	DOI	Publication.Date	PubYear	Source.title	Publisher	ISSN	e.ISSN	Publication.Type	Country.of.Research.organization	FOR..ANZSRC..Categories	for_division	for_group	discipline	Open.Access	Open.Access2	Funder	ukri_funders	Units.of.Assessment	has_ta	sherpa_id	listed_in_doaj	open_access_prohibited	g_article_version	g_license	g_license1	g_license2	g_license3	g_embargo.units	g_embargo	g_embargo2	g_embargo3	g_compliant_repository	g_copyright	rank_green	fee_article_version	fee_license1	fee_license2	fee_license3	fee_copyright	rank_fee	journal_type	articles_in_journal	num_fee	num_current_green	num_new_green	compliance_current	compliance_current2	compliance_new_hybrid	compliance_new_hybrid2	compliance_new	compliance_new2	compliance_new_pure
The relationship between maternal 25-hydroxyvitamin D status in pregnancy and childhood adiposity and allergy: an observational study	10.1038/ijo.2017.182	2017-08-04	2017	international journal of obesity	Springer	0307-0565	1476-5497	Article	Ireland; United Kingdom; United Kingdom; New Zealand; United Kingdom	11 Medical and Health Sciences; 1117 Public Health and Health Services; 1114 Paediatrics and Reproductive Medicine	11 Medical and Health Sciences	1117 Public Health and Health Services; 1114 Paediatrics and Reproductive Medicine	Health Sciences	Green, Accepted	Green	Ministry of Business, Innovation and Employment; Health Research Council of New Zealand; National Institute for Health Research; Medical Research Council; Science Foundation Ireland; Cure Kids; European Commission	MRC	A01 Clinical Medicine	yes	24209	no	no	accepted	no license requirement	no license requirement	no compliant license	not cc_by	months	6	6	has embargo	TRUE	authors	1130	published	cc_by	cc_by	cc_by	authors	1	Hybrid	102	2	30	8	c: hybrid gold	compliant	c: hybrid gold	compliant	c: hybrid gold with a TA	compliant	not compliant
‘Decarbonising’ UK industry: towards a cleaner economy	10.1680/jener.18.00007	2018-05-04	2018	proceedings of the institution of civil engineers - energy	ICE publishing	1751-4223	1751-4231	Article	United Kingdom	09 Engineering; 0905 Civil Engineering	09 Engineering	0905 Civil Engineering	Physical Sciences	Hybrid	Hybrid gold	Engineering and Physical Sciences Research Council	EPSRC	C17 Business and Management Studies	no	12133	no	no	accepted	cc_by	cc_by	cc_by	cc_by	No embargo requirement	0	0	zero embargo	TRUE	authors	2	published	cc_by	cc_by	cc_by	authors	1	Hybrid	4	2	5	1	c: hybrid gold	compliant	c: hybrid gold	compliant	c: confirmed green oa	compliant	c: confirmed green oa
ALMA reveals a pseudo-disc in a proto-brown dwarf	10.1093/mnras/stz1032	2019-04-12	2019	monthly notices of the royal astronomical society	Oxford University Press (OUP)	0035-8711	1365-2966	Article	United Kingdom; Japan; Germany	02 Physical Sciences; 0201 Astronomical and Space Sciences	02 Physical Sciences	0201 Astronomical and Space Sciences	Physical Sciences	Green, Accepted	Green	Science and Technology Facilities Council; German Research Foundation	STFC	B09 Physics	yes	24618	no	no	published	no license requirement	no license requirement	no compliant license	not cc_by	No embargo requirement	0	0	zero embargo	TRUE	authors	833	published	cc_by	cc_by	cc_by	authors	1	Hybrid	2779	2	29	7	c: hybrid gold	compliant	c: hybrid gold	compliant	c: hybrid gold with a TA	compliant	nc: unconfirmed green oa
The Future of Polar Organometallic Chemistry Written in Bio‐Based Solvents and Water	10.1002/chem.201802873	2018-09-20	2018	chemistry - a european journal	Wiley	0947-6539	1521-3765	Article	Spain; United Kingdom; Italy	03 Chemical Sciences; 0305 Organic Chemistry; 0399 Other Chemical Sciences	03 Chemical Sciences	0305 Organic Chemistry; 0399 Other Chemical Sciences	Physical Sciences	Closed	Closed	Fundación BBVA; Engineering and Physical Sciences Research Council; Ministry of Economy, Industry and Competitiveness	EPSRC	B08 Chemistry	yes	1518	no	no	accepted	no license requirement	no license requirement	no compliant license	not cc_by	months	12	12	has embargo	TRUE	authors	1138	published	cc_by	cc_by	cc_by	authors	1	Hybrid	357	2	31	8	c: hybrid gold	compliant	c: hybrid gold	compliant	c: hybrid gold with a TA	compliant	not compliant
Evolution of Photochemical Reaction Centres: More Twists?	10.1016/j.tplants.2019.06.016	2019-07-24	2019	trends in plant science	Elsevier	1360-1385	1878-4372	Article	United Kingdom	06 Biological Sciences; 07 Agricultural and Veterinary Sciences; 0703 Crop and Pasture Production; 0602 Ecology; 0607 Plant Biology	06 Biological Sciences; 07 Agricultural and Veterinary Sciences	0703 Crop and Pasture Production; 0602 Ecology; 0607 Plant Biology	Life Sciences	Green, Submitted	Closed	Biotechnology and Biological Sciences Research Council; Leverhulme Trust	BBSRC	B08 Chemistry	no	14201	no	no	accepted	cc_by_nc_nd	cc_by_nc_nd	no compliant license	not cc_by	No embargo requirement	0	0	zero embargo	FALSE	authors	710	published	cc_by	cc_by	cc_by	authors	1	Hybrid	31	2	29	7	c: hybrid gold	compliant	c: hybrid gold	compliant	not compliant	not compliant	not compliant
Human stem cell–derived astrocytes replicate human prions in a PRNP genotype–dependent mannerHuman prion propagation in human cell culture	10.1084/jem.20161547	2017-11-15	2017	journal of experimental medicine	Rockefeller University Press	0022-1007	1540-9538	Article	United Kingdom; United States; United States; India	11 Medical and Health Sciences; 1109 Neurosciences; 1108 Medical Microbiology	11 Medical and Health Sciences	1109 Neurosciences; 1108 Medical Microbiology	Health Sciences	Hybrid	Hybrid gold	Simons Foundation; Wellcome Trust; Medical Research Council; National Centre for the Replacement Refinement and Reduction of Animals in Research; Department of Health and Social Care; Biotechnology and Biological Sciences Research Council; National Eye Institute; National Institute of Mental Health	BBSRC, MRC, NC3Rs	A04 Psychology, Psychiatry and Neuroscience	yes	25762	no	no	published	no license requirement	no license requirement	no compliant license	not cc_by	No embargo requirement	0	0	zero embargo	TRUE	authors	833	published	cc_by	cc_by	cc_by	authors	1	Hybrid	74	2	29	7	c: hybrid gold	compliant	c: hybrid gold	compliant	c: hybrid gold with a TA	compliant	nc: unconfirmed green oa
Characterisation and laser performance of a Yb:LuAG double-clad planar waveguide grown by pulsed laser deposition	10.1007/s00340-019-7314-9	2019-10-12	2019	applied physics b	Springer	0946-2171	1432-0649	Article	United Kingdom	09 Engineering; 0912 Materials Engineering	09 Engineering	0912 Materials Engineering	Physical Sciences	Hybrid	Hybrid gold	Engineering and Physical Sciences Research Council	EPSRC	B12 Engineering	yes	28050	no	no	accepted	no license requirement	no license requirement	no compliant license	not cc_by	No embargo requirement	0	0	zero embargo	FALSE	authors	838	published	cc_by	cc_by	cc_by	authors	1	Hybrid	17	2	29	7	c: hybrid gold	compliant	c: hybrid gold	compliant	c: hybrid gold with a TA	compliant	not compliant
Clarification of Governance Relevant to the Sustainable Management of Marine Species and Habitats within the United Kingdom: An Overview of Regional, National and International Authorities, Advisories, Legislation and Designation Types with Summary Schematic Tool	10.1007/s00267-018-1064-z	2018-06-17	2018	environmental management	Springer	0933-0437	1432-1009	Article	United Kingdom; United Kingdom	05 Environmental Sciences; 06 Biological Sciences; 0502 Environmental Science and Management; 0602 Ecology	05 Environmental Sciences; 06 Biological Sciences	0502 Environmental Science and Management; 0602 Ecology	Physical Sciences; Life Sciences	Hybrid	Hybrid gold	Natural Environment Research Council	NERC	B07 Earth Systems and Environmental Sciences	yes	15704	no	no	accepted	no license requirement	no license requirement	no compliant license	not cc_by	No embargo requirement	0	0	zero embargo	FALSE	authors	838	published	cc_by	cc_by	cc_by	authors	1	Hybrid	8	2	29	7	c: hybrid gold	compliant	c: hybrid gold	compliant	c: hybrid gold with a TA	compliant	not compliant
Economic reasons for not wanting a second child: Changes before and after the onset of the economic recession in Italy	10.4054/demres.2018.38.30	2018-03-02	2018	demographic research	Max Planck Institute for Demographic Research	1435-9871	2363-7064	Article	NA	16 Studies in Human Society; 1603 Demography	16 Studies in Human Society	1603 Demography	Social Sciences	Pure Gold	Pure Gold	Economic and Social Research Council	ESRC	C20 Social Work and Social Policy	no	NA	NA	NA	NA	NA	NA	NA	NA	NA	NA	NA	NA	NA	NA	NA	NA	NA	NA	NA	NA	NA	Pure Gold	25	4	99	99	c: pure gold	compliant	c: pure gold	compliant	c: pure gold	compliant	c: pure gold
Room-Temperature Mid-Infrared Emission from Faceted InAsSb Multi Quantum Wells Embedded in InAs Nanowires.	10.1021/acs.nanolett.7b03977	2017-11-30	2017	nano letters	American Chemical Society (ACS)	1530-6984	1530-6992	Article	United Kingdom; United Kingdom; Saudi Arabia	09 Engineering; 02 Physical Sciences; 0912 Materials Engineering; 0205 Optical Physics	09 Engineering; 02 Physical Sciences	0912 Materials Engineering; 0205 Optical Physics	Physical Sciences	Hybrid	Hybrid gold	Engineering and Physical Sciences Research Council; Royal Academy of Engineering; Defence Science and Technology Laboratory	EPSRC	B12 Engineering; B09 Physics	no	7792	no	no	accepted	no license requirement	no license requirement	no compliant license	not cc_by	months	12	12	has embargo	TRUE	authors	1138	published	cc_by	cc_by	cc_by	publishers	2	Hybrid	211	2	31	8	c: hybrid gold	compliant	c: hybrid gold	compliant	not compliant	not compliant	not compliant
Association between fat mass through adolescence and arterial stiffness: a population-based study from The Avon Longitudinal Study of Parents and Children	10.1016/s2352-4642(19)30105-1	2019-05-21	2019	the lancet child & adolescent health	Elsevier	2352-4642	2352-4650	Article	Greece; Netherlands; United Kingdom; United Kingdom; United Kingdom; United Kingdom; Sweden	11 Medical and Health Sciences; 1103 Clinical Sciences; 1117 Public Health and Health Services	11 Medical and Health Sciences	1103 Clinical Sciences; 1117 Public Health and Health Services	Health Sciences	Hybrid	Hybrid gold	Wellcome Trust; Cancer Research UK; National Institute for Health Research; Medical Research Council; British Heart Foundation	MRC	A02 Public Health, Health Services and Primary Care	no	NA	NA	NA	NA	NA	NA	NA	NA	NA	NA	NA	NA	NA	NA	NA	NA	NA	NA	NA	NA	NA	Hybrid	50	5	99	99	c: hybrid gold	compliant	c: hybrid gold	compliant	not compliant	not compliant	not compliant
In search of oculomotor capture during film viewing: Implications for the balance of top-down and bottom-up control in the saccadic system	10.1016/j.visres.2017.01.007	2017-04-06	2017	vision research	Elsevier	0042-6989	1878-5646	Article	United Kingdom; United Kingdom	17 Psychology and Cognitive Sciences; 1701 Psychology	17 Psychology and Cognitive Sciences	1701 Psychology	Social Sciences	Hybrid	Hybrid gold	Engineering and Physical Sciences Research Council	EPSRC	A04 Psychology, Psychiatry and Neuroscience	no	4712	no	no	accepted	cc_by_nc_nd	cc_by_nc_nd	no compliant license	not cc_by	No embargo requirement	0	0	zero embargo	FALSE	authors	710	published	cc_by	cc_by	cc_by	authors	1	Hybrid	19	2	29	7	c: hybrid gold	compliant	c: hybrid gold	compliant	not compliant	not compliant	not compliant
